{
    "display_name": "Course Name",
    "domain": "Course Domain",
    "unique_name": "course_name",
    "default_topic": "Topic 1",
    "curriculum": {
        "Topic 1": ["task_1", "task_2"],
        "Topic 2": ["task_3", "task_4"]
    },

    "competencies": ["competency_1", "competency_2"],
    "q_matrix": {
        "task_1": [1, 1],
        "task_2": [1, 0],
        "task_3": [0, 1],
        "task_4": [0, 1]
    },
    "course_parameters": {
        "skill_weights_pfa": [0,0,0,0,0,0]
    },
    "course_settings": {
        "feedback_init_time": 60,
        "feedback_cooldown": 30,
        "pedagogical_model": "prototype"
    }
}
